Sheet: Sheet1
A1: 스킬 ID | B1: 스킬레벨 | C1: 스킬이름 | D1: 아이콘 | E1: 에니 | F1: 이펙트 | G1: 스킬 타입 | H1: 사운드 | I1: 캐릭레벨 | J1: 세력분류 | K1: 공전 | L1: 방전 | M1: 정로 | N1: 사로 | O1: 공법 | P1: 보법 | Q1: 성장속도 | R1: 포인트 | S1: 기본분류 | T1: 공격형태별 | U1: 효과형태별 | V1: 세부분류 | W1: 요구착용무기1 | X1: 요구착용무기2 | Y1: 요구착용무기3 | Z1: 요구착용무기4 | AA1: 요구착용무기5 | AB1: 요구착용무기6 | AC1: 요구착용무기7 | AD1: 요구착용무기8 | AE1: 요구착용무기9 | AF1: 요구착용무기10 | AG1: 요구착용무기11 | AH1: 요구착용무기12 | AI1: 요구착용무기13 | AJ1: 요구착용무기14 | AK1: 요구착용무기15 | AL1: 요구착용무기19 | AM1: 소모SP | AN1: 소모MP | AO1: 시전시간 | AP1: 쿨타임 | AQ1: 사거리 | AR1: 상태속성 | AS1: 4대속성 | AT1: 딜레이 | AU1: 요구선행스킬 | AV1: 성공확률종류 | AW1: 성공확률 | AX1: 타겟형태 | AY1: 적용범위 | AZ1: 연타횟수 | BA1: 지속시간 | BB1: 무기종류1 | BC1: 무기종류2 | BD1: 능력치 | BE1: 가방수 | BF1: 어그로 | BG1: 일반공격데미지 타입 | BH1: 일반공격데미지 HP | BI1: 일반공격데미지 SP | BJ1: 일반공격데미지 MP | BK1: 지속데미지 타입 | BL1: 지속데미지 HP | BM1: 지속데미지 SP | BN1: 지속데미지 MP | BO1: 추가데미지 HP | BP1: 추가데미지 SP | BQ1: 추가데미지 MP | BR1: 종류1 | BS1: 값1 | BT1: 종류2 | BU1: 값2 | BV1: 종류3 | BW1: 값3 | BX1: 종류4 | BY1: 값4 | BZ1: 종류5 | CA1: 값5 | CB1: 종류6 | CC1: 값6 | CD1: 종류7 | CE1: 값7 | CF1: 종류8 | CG1: 값8 | CH1: 종류9 | CI1: 값9 | CJ1: 종류10 | CK1: 값10 | CL1: 힐 HP | CM1: 힐 SP | CN1: 힐 MP | CO1: 지속힐 HP | CP1: 지속힐 SP | CQ1: 지속힐 MP | CR1: 회피 분류 | CS1: 회피 값 | CT1: 저력제한HP | CU1: 사망 후 지속 | CV1: 변신 종류 | CW1: 변신 값 | CX1: 텍스트
A2: id | B2: skilllevel | C2: name | D2: image | E2: ani | F2: effect | G2: toggletype | H2: sound | I2: level | J2: country | K2: attackfighter | L2: defensefighter | M2: patrolrogue | N2: shootrogue | O2: attackmage | P2: defensemage | Q2: grow | R2: point | S2: typeshow | T2: typeattack | U2: typeeffect | V2: type | W2: needweapon1 | X2: needweapon2 | Y2: needweapon3 | Z2: needweapon4 | AA2: needweapon5 | AB2: needweapon6 | AC2: needweapon7 | AD2: needweapon8 | AE2: needweapon9 | AF2: needweapon10 | AG2: needweapon11 | AH2: needweapon12 | AI2: needweapon13 | AJ2: needweapon14 | AK2: needweapon15 | AL2: shield | AM2: sp | AN2: mp | AO2: readytime | AP2: resettime | AQ2: attackrange | AR2: statetype | AS2: attribtype | AT2: disable | AU2: prevskill | AV2: successtype | AW2: successvalue | AX2: targettype | AY2: applyrange | AZ2: multiattack | BA2: keeptime | BB2: weapon1 | BC2: weapon2 | BD2: weaponvalue | BE2: bag | BF2: arrow | BG2: damagetype | BH2: damage1 | BI2: damage2 | BJ2: damage3 | BK2: timedamagetype | BL2: timedamage1 | BM2: timedamage2 | BN2: timedamage3 | BO2: adddamage1 | BP2: adddamage2 | BQ2: adddamage3 | BR2: abilitytype1 | BS2: abilityvalue1 | BT2: abilitytype2 | BU2: abilityvalue2 | BV2: abilitytype3 | BW2: abilityvalue3 | BX2: abilitytype4 | BY2: abilityvalue4 | BZ2: abilitytype5 | CA2: abilityvalue5 | CB2: abilitytype6 | CC2: abilityvalue6 | CD2: abilitytype7 | CE2: abilityvalue7 | CF2: abilitytype8 | CG2: abilityvalue8 | CH2: abilitytype9 | CI2: abilityvalue9 | CJ2: abilitytype10 | CK2: abilityvalue10 | CL2: heal1 | CM2: heal2 | CN2: heal3 | CO2: timeheal1 | CP2: timeheal2 | CQ2: timeheal3 | CR2: defencetype | CS2: defencevalue | CT2: limithp | CU2: fixrange | CV2: changetype | CW2: changelevel | CX2: text
A3: 112 | B3: 1 | C3: 리더쉽Lv1 | D3: 112 | E3: 0 | F3: 0 | G3: 0 | H3: 0 | I3: 7 | J3: 6 | K3: 1 | L3: 0 | M3: 0 | N3: 0 | O3: 0 | P3: 0 | Q3: 1 | R3: 1 | S3: 4 | T3: 0 | U3: 4 | V3: 82 | W3: 1 | X3: 1 | Y3: 1 | Z3: 1 | AA3: 1 | AB3: 1 | AC3: 1 | AD3: 1 | AE3: 1 | AF3: 1 | AG3: 1 | AH3: 1 | AI3: 1 | AJ3: 1 | AK3: 1 | AL3: 0 | AM3: 70 | AN3: 55 | AO3: 0 | AP3: 1 | AQ3: 0 | AR3: 0 | AS3: 0 | AT3: 0 | AU3: 0 | AV3: 1 | AW3: 100 | AX3: 4 | AY3: 50 | AZ3: 0 | BA3: 900 | BB3: 0 | BC3: 0 | BD3: 0 | BE3: 0 | BF3: 0 | BG3: 0 | BH3: 0 | BI3: 0 | BJ3: 0 | BK3: 0 | BL3: 0 | BM3: 0 | BN3: 0 | BO3: 0 | BP3: 0 | BQ3: 0 | BR3: 23 | BS3: 13 | BT3: 0 | BU3: 0 | BV3: 0 | BW3: 0 | BX3: 0 | BY3: 0 | BZ3: 0 | CA3: 0 | CB3: 0 | CC3: 0 | CD3: 0 | CE3: 0 | CF3: 0 | CG3: 0 | CH3: 0 | CI3: 0 | CJ3: 0 | CK3: 0 | CL3: 0 | CM3: 0 | CN3: 0 | CO3: 0 | CP3: 0 | CQ3: 0 | CR3: 0 | CS3: 0 | CT3: 0 | CU3: 0 | CV3: 0 | CW3: 0 | CX3: 15분간 자신 반경 <[applyrange]>m 이내의 파티 전원의 물리공격력을 <[abilityvalue1]>만큼 높이는 주문
A4: 181 | B4: 1 | C4: 데이플라이_실드Lv1 | D4: 181 | E4: 0 | F4: 0 | G4: 0 | H4: 0 | I4: 50 | J4: 6 | K4: 0 | L4: 1 | M4: 0 | N4: 0 | O4: 0 | P4: 0 | Q4: 2 | R4: 7 | S4: 4 | T4: 0 | U4: 4 | V4: 83 | W4: 1 | X4: 1 | Y4: 1 | Z4: 1 | AA4: 1 | AB4: 1 | AC4: 1 | AD4: 1 | AE4: 1 | AF4: 1 | AG4: 1 | AH4: 1 | AI4: 1 | AJ4: 1 | AK4: 1 | AL4: 0 | AM4: 620 | AN4: 470 | AO4: 0 | AP4: 720 | AQ4: 0 | AR4: 0 | AS4: 0 | AT4: 0 | AU4: 0 | AV4: 1 | AW4: 100 | AX4: 4 | AY4: 8 | AZ4: 0 | BA4: 5 | BB4: 0 | BC4: 0 | BD4: 0 | BE4: 0 | BF4: 0 | BG4: 0 | BH4: 0 | BI4: 0 | BJ4: 0 | BK4: 0 | BL4: 0 | BM4: 0 | BN4: 0 | BO4: 0 | BP4: 0 | BQ4: 0 | BR4: 0 | BS4: 1 | BT4: 0 | BU4: 1 | BV4: 0 | BW4: 1 | BX4: 0 | BY4: 0 | BZ4: 0 | CA4: 0 | CB4: 0 | CC4: 0 | CD4: 0 | CE4: 0 | CF4: 0 | CG4: 0 | CH4: 0 | CI4: 0 | CJ4: 0 | CK4: 0 | CL4: 0 | CM4: 0 | CN4: 0 | CO4: 0 | CP4: 0 | CQ4: 0 | CR4: 0 | CS4: 0 | CT4: 0 | CU4: 0 | CV4: 0 | CW4: 0 | CX4: <[keeptime]>초간 반경 8m 범위 내 파티원 전원에게 지속적인 피해와 활력, 마력 피해를 제외한 모든 공격으로부터 보호시키며, 데미지를 적에게 반사시키는 최강의 방어 기술\n일부 몬스터는 내성을 가지고 있다
A5: 345 | B5: 1 | C5: 일레이트Lv1 | D5: 1050 | E5: 87 | F5: 0 | G5: 0 | H5: 0 | I5: 24 | J5: 6 | K5: 0 | L5: 1 | M5: 0 | N5: 0 | O5: 0 | P5: 0 | Q5: 0 | R5: 2 | S5: 4 | T5: 0 | U5: 4 | V5: 82 | W5: 1 | X5: 1 | Y5: 1 | Z5: 1 | AA5: 0 | AB5: 1 | AC5: 1 | AD5: 1 | AE5: 0 | AF5: 0 | AG5: 0 | AH5: 0 | AI5: 0 | AJ5: 0 | AK5: 0 | AL5: 0 | AM5: 1 | AN5: 1 | AO5: 0 | AP5: 18 | AQ5: 2 | AR5: 0 | AS5: 0 | AT5: 0 | AU5: 0 | AV5: 1 | AW5: 100 | AX5: 3 | AY5: 0 | AZ5: 0 | BA5: 12 | BB5: 0 | BC5: 0 | BD5: 0 | BE5: 0 | BF5: 0 | BG5: 0 | BH5: 0 | BI5: 0 | BJ5: 0 | BK5: 0 | BL5: 0 | BM5: 0 | BN5: 0 | BO5: 0 | BP5: 0 | BQ5: 0 | BR5: 5 | BS5: 55 | BT5: 0 | BU5: 0 | BV5: 0 | BW5: 0 | BX5: 0 | BY5: 0 | BZ5: 0 | CA5: 0 | CB5: 0 | CC5: 0 | CD5: 0 | CE5: 0 | CF5: 0 | CG5: 0 | CH5: 0 | CI5: 0 | CJ5: 0 | CK5: 0 | CL5: 0 | CM5: 0 | CN5: 0 | CO5: 0 | CP5: 0 | CQ5: 0 | CR5: 0 | CS5: 0 | CT5: 0 | CU5: 0 | CV5: 0 | CW5: 0 | CX5: 활력과 마력을 모두 소모하여 방어력으로 치환한 후, <[keeptime]>초 동안 대상의 반응값을 <[abilityvalue1]> 만큼 상승시키는 버프
A6: 617 | B6: 1 | C6: 리더쉽 | D6: 112 | E6: 0 | F6: 0 | G6: 0 | H6: 0 | I6: 2 | J6: 6 | K6: 1 | L6: 0 | M6: 0 | N6: 0 | O6: 0 | P6: 0 | Q6: 1 | R6: 2 | S6: 2 | T6: 0 | U6: 4 | V6: 82 | W6: 1 | X6: 1 | Y6: 1 | Z6: 1 | AA6: 1 | AB6: 1 | AC6: 1 | AD6: 1 | AE6: 1 | AF6: 1 | AG6: 1 | AH6: 1 | AI6: 1 | AJ6: 1 | AK6: 1 | AL6: 0 | AM6: =INT(38.94) -> 38 | AN6: =INT(19.47) -> 19 | AO6: 0 | AP6: 30 | AQ6: 0 | AR6: 0 | AS6: 0 | AT6: 0 | AU6: 0 | AV6: 1 | AW6: 100 | AX6: 8 | AY6: 15 | AZ6: 0 | BA6: 900 | BB6: 0 | BC6: 0 | BD6: 0 | BE6: 0 | BF6: 0 | BG6: 0 | BH6: 0 | BI6: 0 | BJ6: 0 | BK6: 0 | BL6: 0 | BM6: 0 | BN6: 0 | BO6: 0 | BP6: 0 | BQ6: 0 | BR6: 23 | BS6: 42 | BT6: 0 | BU6: 0 | BV6: 0 | BW6: 0 | BX6: 0 | BY6: 0 | BZ6: 0 | CA6: 0 | CB6: 0 | CC6: 0 | CD6: 0 | CE6: 0 | CF6: 0 | CG6: 0 | CH6: 0 | CI6: 0 | CJ6: 0 | CK6: 0 | CL6: 0 | CM6: 0 | CN6: 0 | CO6: 0 | CP6: 0 | CQ6: 0 | CR6: 0 | CS6: 0 | CT6: 0 | CU6: 0 | CV6: 0 | CW6: 0 | CX6: 15분간 자신 반경 <[applyrange]>m 이내의 파티나 유니온 전원의 물리공격력을 <[abilityvalue1]>만큼 높이는 주문
A7: 654 | B7: 2 | C7: 데이플라이 가드 | D7: 181 | E7: 0 | F7: 0 | G7: 0 | H7: 0 | I7: 30 | J7: 6 | K7: 0 | L7: 1 | M7: 0 | N7: 0 | O7: 0 | P7: 0 | Q7: 2 | R7: 12 | S7: 2 | T7: 0 | U7: 4 | V7: 83 | W7: 1 | X7: 1 | Y7: 1 | Z7: 1 | AA7: 1 | AB7: 1 | AC7: 1 | AD7: 1 | AE7: 1 | AF7: 1 | AG7: 1 | AH7: 1 | AI7: 1 | AJ7: 1 | AK7: 1 | AL7: 0 | AM7: =INT(168.73) -> 168 | AN7: =INT(175.91) -> 175 | AO7: 0 | AP7: 100 | AQ7: 0 | AR7: 0 | AS7: 0 | AT7: 0 | AU7: 0 | AV7: 1 | AW7: 100 | AX7: 8 | AY7: 7 | AZ7: 0 | BA7: 4 | BB7: 0 | BC7: 0 | BD7: 0 | BE7: 0 | BF7: 0 | BG7: 0 | BH7: 0 | BI7: 0 | BJ7: 0 | BK7: 0 | BL7: 0 | BM7: 0 | BN7: 0 | BO7: 0 | BP7: 0 | BQ7: 0 | BR7: 0 | BS7: 1 | BT7: 0 | BU7: 1 | BV7: 0 | BW7: 1 | BX7: 0 | BY7: 0 | BZ7: 0 | CA7: 0 | CB7: 0 | CC7: 0 | CD7: 0 | CE7: 0 | CF7: 0 | CG7: 0 | CH7: 0 | CI7: 0 | CJ7: 0 | CK7: 0 | CL7: 0 | CM7: 0 | CN7: 0 | CO7: 0 | CP7: 0 | CQ7: 0 | CR7: 0 | CS7: 0 | CT7: 0 | CU7: 0 | CV7: 0 | CW7: 0 | CX7: <[keeptime]>초간 반경 <[applyrange]>m 범위 내 파티나 유니온 전원에게 지속적인 피해와 활력, 마력 피해를 제외한 모든 공격으로부터 보호시키며, 데미지를 적에게 반사시키는 최강의 방어 기술\n일부 몬스터는 내성을 가지고 있다
A8: 658 | B8: 2 | C8: 일레이트 | D8: 1050 | E8: 87 | F8: 0 | G8: 0 | H8: 0 | I8: 11 | J8: 6 | K8: 0 | L8: 1 | M8: 0 | N8: 0 | O8: 0 | P8: 0 | Q8: 0 | R8: 2 | S8: 2 | T8: 0 | U8: 4 | V8: 82 | W8: 1 | X8: 1 | Y8: 1 | Z8: 1 | AA8: 1 | AB8: 1 | AC8: 1 | AD8: 1 | AE8: 1 | AF8: 1 | AG8: 1 | AH8: 1 | AI8: 1 | AJ8: 1 | AK8: 1 | AL8: 0 | AM8: 1 | AN8: 1 | AO8: 0 | AP8: 1 | AQ8: 2 | AR8: 0 | AS8: 0 | AT8: 0 | AU8: 0 | AV8: 1 | AW8: 100 | AX8: 3 | AY8: 0 | AZ8: 0 | BA8: 12 | BB8: 0 | BC8: 0 | BD8: 0 | BE8: 0 | BF8: 0 | BG8: 0 | BH8: 0 | BI8: 0 | BJ8: 0 | BK8: 0 | BL8: 0 | BM8: 0 | BN8: 0 | BO8: 0 | BP8: 0 | BQ8: 0 | BR8: 5 | BS8: 57 | BT8: 0 | BU8: 0 | BV8: 0 | BW8: 0 | BX8: 0 | BY8: 0 | BZ8: 0 | CA8: 0 | CB8: 0 | CC8: 0 | CD8: 0 | CE8: 0 | CF8: 0 | CG8: 0 | CH8: 0 | CI8: 0 | CJ8: 0 | CK8: 0 | CL8: 0 | CM8: 0 | CN8: 0 | CO8: 0 | CP8: 0 | CQ8: 0 | CR8: 0 | CS8: 0 | CT8: 0 | CU8: 0 | CV8: 0 | CW8: 0 | CX8: 활력과 마력을 모두 소모하여 방어력으로 치환한 후, <[keeptime]>초 동안 대상의 반응값을 <[abilityvalue1]> 만큼 상승시키는 버프
A9: 686 | B9: 1 | C9: 인켄테이션 | D9: 120 | E9: 0 | F9: 0 | G9: 0 | H9: 0 | I9: 65 | J9: 6 | K9: 0 | L9: 0 | M9: 1 | N9: 0 | O9: 0 | P9: 0 | Q9: 1 | R9: 3 | S9: 2 | T9: 0 | U9: 4 | V9: 82 | W9: 1 | X9: 1 | Y9: 1 | Z9: 1 | AA9: 1 | AB9: 1 | AC9: 1 | AD9: 1 | AE9: 1 | AF9: 1 | AG9: 1 | AH9: 1 | AI9: 1 | AJ9: 1 | AK9: 1 | AL9: 0 | AM9: =INT(865.8) -> 865 | AN9: =INT(205.4) -> 205 | AO9: 0 | AP9: 60 | AQ9: 0 | AR9: 0 | AS9: 0 | AT9: 0 | AU9: 0 | AV9: 1 | AW9: 100 | AX9: 8 | AY9: 15 | AZ9: 0 | BA9: 900 | BB9: 0 | BC9: 0 | BD9: 0 | BE9: 0 | BF9: 0 | BG9: 0 | BH9: 0 | BI9: 0 | BJ9: 0 | BK9: 0 | BL9: 0 | BM9: 0 | BN9: 0 | BO9: 0 | BP9: 0 | BQ9: 0 | BR9: 9 | BS9: 230 | BT9: 0 | BU9: 0 | BV9: 0 | BW9: 0 | BX9: 0 | BY9: 0 | BZ9: 0 | CA9: 0 | CB9: 0 | CC9: 0 | CD9: 0 | CE9: 0 | CF9: 0 | CG9: 0 | CH9: 0 | CI9: 0 | CJ9: 0 | CK9: 0 | CL9: 0 | CM9: 0 | CN9: 0 | CO9: 0 | CP9: 0 | CQ9: 0 | CR9: 0 | CS9: 0 | CT9: 0 | CU9: 0 | CV9: 0 | CW9: 0 | CX9: 15분간 자신이 속한 파티나 유니온의 행운을 <[abilityvalue1]> 높이는 주문\n자신 중심 반경 <[applyrange]>m 이내의 파티나 유니온 전원에게 혜택을 줄 수 있다
A10: 744 | B10: 1 | C10: 서포트 스펠 | D10: 117 | E10: 0 | F10: 0 | G10: 0 | H10: 0 | I10: 2 | J10: 6 | K10: 0 | L10: 0 | M10: 0 | N10: 0 | O10: 1 | P10: 0 | Q10: 1 | R10: 2 | S10: 2 | T10: 0 | U10: 4 | V10: 82 | W10: 1 | X10: 1 | Y10: 1 | Z10: 1 | AA10: 1 | AB10: 1 | AC10: 1 | AD10: 1 | AE10: 1 | AF10: 1 | AG10: 1 | AH10: 1 | AI10: 1 | AJ10: 1 | AK10: 1 | AL10: 0 | AM10: =INT(18.24) -> 18 | AN10: =INT(66.88) -> 66 | AO10: 0 | AP10: 60 | AQ10: 0 | AR10: 0 | AS10: 0 | AT10: 0 | AU10: 0 | AV10: 1 | AW10: 100 | AX10: 8 | AY10: 10 | AZ10: 0 | BA10: 900 | BB10: 0 | BC10: 0 | BD10: 0 | BE10: 0 | BF10: 0 | BG10: 0 | BH10: 0 | BI10: 0 | BJ10: 0 | BK10: 0 | BL10: 0 | BM10: 0 | BN10: 0 | BO10: 0 | BP10: 0 | BQ10: 0 | BR10: 25 | BS10: 30 | BT10: 2 | BU10: 60 | BV10: 0 | BW10: 0 | BX10: 0 | BY10: 0 | BZ10: 0 | CA10: 0 | CB10: 0 | CC10: 0 | CD10: 0 | CE10: 0 | CF10: 0 | CG10: 0 | CH10: 0 | CI10: 0 | CJ10: 0 | CK10: 0 | CL10: 0 | CM10: 0 | CN10: 0 | CO10: 0 | CP10: 0 | CQ10: 0 | CR10: 0 | CS10: 0 | CT10: 0 | CU10: 0 | CV10: 0 | CW10: 0 | CX10: 15분간 자신 중심 반경 <[applyrange]>m 이내 파티나 유니온 전원의 마법공격력을 <[abilityvalue1]> 높여주고, 최대 마력을 <[abilityvalue2]> 만큼 높여주는 버프
A11: 767 | B11: 1 | C11: 스피릿 스트림 | D11: 1094 | E11: 0 | F11: 0 | G11: 0 | H11: 0 | I11: 9 | J11: 6 | K11: 0 | L11: 0 | M11: 0 | N11: 0 | O11: 0 | P11: 1 | Q11: 2 | R11: 2 | S11: 2 | T11: 0 | U11: 4 | V11: 81 | W11: 1 | X11: 1 | Y11: 1 | Z11: 1 | AA11: 1 | AB11: 1 | AC11: 1 | AD11: 1 | AE11: 1 | AF11: 1 | AG11: 1 | AH11: 1 | AI11: 1 | AJ11: 1 | AK11: 1 | AL11: 0 | AM11: =INT(31.8) -> 31 | AN11: =INT(127.2) -> 127 | AO11: 10 | AP11: 1 | AQ11: 24 | AR11: 0 | AS11: 0 | AT11: 0 | AU11: 0 | AV11: 1 | AW11: 100 | AX11: 3 | AY11: 0 | AZ11: 0 | BA11: 60 | BB11: 0 | BC11: 0 | BD11: 0 | BE11: 0 | BF11: 0 | BG11: 0 | BH11: 0 | BI11: 0 | BJ11: 0 | BK11: 0 | BL11: 0 | BM11: 0 | BN11: 0 | BO11: 0 | BP11: 0 | BQ11: 0 | BR11: 0 | BS11: 0 | BT11: 0 | BU11: 0 | BV11: 0 | BW11: 0 | BX11: 0 | BY11: 0 | BZ11: 0 | CA11: 0 | CB11: 0 | CC11: 0 | CD11: 0 | CE11: 0 | CF11: 0 | CG11: 0 | CH11: 0 | CI11: 0 | CJ11: 0 | CK11: 0 | CL11: 0 | CM11: 0 | CN11: 0 | CO11: 0 | CP11: 0 | CQ11: 120 | CR11: 0 | CS11: 0 | CT11: 0 | CU11: 0 | CV11: 0 | CW11: 0 | CX11: 1분 동안 대상의 MP를 주기적으로 <[timeheal3]>만큼 회복한다.
A12: 768 | B12: 1 | C12: 오오라 오브 피스 | D12: 116 | E12: 0 | F12: 0 | G12: 0 | H12: 0 | I12: 7 | J12: 6 | K12: 0 | L12: 0 | M12: 0 | N12: 0 | O12: 0 | P12: 1 | Q12: 1 | R12: 3 | S12: 2 | T12: 0 | U12: 4 | V12: 82 | W12: 1 | X12: 1 | Y12: 1 | Z12: 1 | AA12: 1 | AB12: 1 | AC12: 1 | AD12: 1 | AE12: 1 | AF12: 1 | AG12: 1 | AH12: 1 | AI12: 1 | AJ12: 1 | AK12: 1 | AL12: 0 | AM12: 0 | AN12: =INT(91.44) -> 91 | AO12: 0 | AP12: 1 | AQ12: 24 | AR12: 0 | AS12: 0 | AT12: 0 | AU12: 0 | AV12: 1 | AW12: 100 | AX12: 3 | AY12: 0 | AZ12: 0 | BA12: 1800 | BB12: 0 | BC12: 0 | BD12: 0 | BE12: 0 | BF12: 0 | BG12: 0 | BH12: 0 | BI12: 0 | BJ12: 0 | BK12: 0 | BL12: 0 | BM12: 0 | BN12: 0 | BO12: 0 | BP12: 0 | BQ12: 0 | BR12: 1 | BS12: 263 | BT12: 0 | BU12: 0 | BV12: 0 | BW12: 0 | BX12: 0 | BY12: 0 | BZ12: 0 | CA12: 0 | CB12: 0 | CC12: 0 | CD12: 0 | CE12: 0 | CF12: 0 | CG12: 0 | CH12: 0 | CI12: 0 | CJ12: 0 | CK12: 0 | CL12: 0 | CM12: 0 | CN12: 0 | CO12: 0 | CP12: 0 | CQ12: 0 | CR12: 0 | CS12: 0 | CT12: 0 | CU12: 0 | CV12: 0 | CW12: 0 | CX12: 30분간 대상의 최대 체력을 <[abilityvalue1]> 높여주는 주문
A13: 769 | B13: 1 | C13: 프레이어 | D13: 123 | E13: 0 | F13: 0 | G13: 0 | H13: 0 | I13: 5 | J13: 6 | K13: 0 | L13: 0 | M13: 0 | N13: 0 | O13: 0 | P13: 1 | Q13: 1 | R13: 5 | S13: 2 | T13: 0 | U13: 4 | V13: 82 | W13: 1 | X13: 1 | Y13: 1 | Z13: 1 | AA13: 1 | AB13: 1 | AC13: 1 | AD13: 1 | AE13: 1 | AF13: 1 | AG13: 1 | AH13: 1 | AI13: 1 | AJ13: 1 | AK13: 1 | AL13: 0 | AM13: =INT(26.25) -> 26 | AN13: =INT(103.25) -> 103 | AO13: 0 | AP13: 60 | AQ13: 0 | AR13: 0 | AS13: 0 | AT13: 0 | AU13: 0 | AV13: 1 | AW13: 100 | AX13: 8 | AY13: 10 | AZ13: 0 | BA13: 600 | BB13: 0 | BC13: 0 | BD13: 0 | BE13: 0 | BF13: 0 | BG13: 0 | BH13: 0 | BI13: 0 | BJ13: 0 | BK13: 0 | BL13: 0 | BM13: 0 | BN13: 0 | BO13: 0 | BP13: 0 | BQ13: 0 | BR13: 4 | BS13: 38 | BT13: 5 | BU13: 38 | BV13: 7 | BW13: 38 | BX13: 0 | BY13: 0 | BZ13: 0 | CA13: 0 | CB13: 0 | CC13: 0 | CD13: 0 | CE13: 0 | CF13: 0 | CG13: 0 | CH13: 0 | CI13: 0 | CJ13: 0 | CK13: 0 | CL13: 0 | CM13: 0 | CN13: 0 | CO13: 0 | CP13: 0 | CQ13: 0 | CR13: 0 | CS13: 0 | CT13: 0 | CU13: 0 | CV13: 0 | CW13: 0 | CX13: <[keeptime]>초간 <[applyrange]>m 내의 파티나 유니온 전원의 근력, 반응, 지혜를 각각 <[abilityvalue1]> 높이도록 기도하는 주문
A14: 770 | B14: 1 | C14: 막스맨 송 | D14: 121 | E14: 0 | F14: 0 | G14: 0 | H14: 0 | I14: 12 | J14: 6 | K14: 0 | L14: 0 | M14: 0 | N14: 0 | O14: 0 | P14: 1 | Q14: 1 | R14: 4 | S14: 2 | T14: 0 | U14: 4 | V14: 82 | W14: 1 | X14: 1 | Y14: 1 | Z14: 1 | AA14: 1 | AB14: 1 | AC14: 1 | AD14: 1 | AE14: 1 | AF14: 1 | AG14: 1 | AH14: 1 | AI14: 1 | AJ14: 1 | AK14: 1 | AL14: 0 | AM14: =INT(195.22) -> 195 | AN14: =INT(54.48) -> 54 | AO14: 0 | AP14: 60 | AQ14: 0 | AR14: 0 | AS14: 0 | AT14: 0 | AU14: 0 | AV14: 1 | AW14: 100 | AX14: 8 | AY14: 15 | AZ14: 0 | BA14: 900 | BB14: 0 | BC14: 0 | BD14: 0 | BE14: 0 | BF14: 0 | BG14: 0 | BH14: 0 | BI14: 0 | BJ14: 0 | BK14: 0 | BL14: 0 | BM14: 0 | BN14: 0 | BO14: 0 | BP14: 0 | BQ14: 0 | BR14: 24 | BS14: 59 | BT14: 27 | BU14: 59 | BV14: 3 | BW14: 150 | BX14: 0 | BY14: 0 | BZ14: 0 | CA14: 0 | CB14: 0 | CC14: 0 | CD14: 0 | CE14: 0 | CF14: 0 | CG14: 0 | CH14: 0 | CI14: 0 | CJ14: 0 | CK14: 0 | CL14: 0 | CM14: 0 | CN14: 0 | CO14: 0 | CP14: 0 | CQ14: 0 | CR14: 0 | CS14: 0 | CT14: 0 | CU14: 0 | CV14: 0 | CW14: 0 | CX14: 15분간<[applyrange]>m 내의 자신이 속한 파티나 유니온의 사격공격력과 사격방어력을 <[abilityvalue1]> 높이고 추가로 최대 활력을 <[abilityvalue3]> 만큼 상승시켜주는 주문
A15: 771 | B15: 1 | C15: 바디 프로텍터 | D15: 132 | E15: 0 | F15: 0 | G15: 0 | H15: 0 | I15: 2 | J15: 6 | K15: 0 | L15: 0 | M15: 0 | N15: 0 | O15: 0 | P15: 1 | Q15: 0 | R15: 5 | S15: 2 | T15: 0 | U15: 4 | V15: 82 | W15: 1 | X15: 1 | Y15: 1 | Z15: 1 | AA15: 1 | AB15: 1 | AC15: 1 | AD15: 1 | AE15: 1 | AF15: 1 | AG15: 1 | AH15: 1 | AI15: 1 | AJ15: 1 | AK15: 1 | AL15: 0 | AM15: =INT(15.86) -> 15 | AN15: =INT(58.56) -> 58 | AO15: 0 | AP15: 60 | AQ15: 0 | AR15: 0 | AS15: 0 | AT15: 0 | AU15: 0 | AV15: 1 | AW15: 100 | AX15: 8 | AY15: 6 | AZ15: 0 | BA15: 480 | BB15: 0 | BC15: 0 | BD15: 0 | BE15: 0 | BF15: 0 | BG15: 0 | BH15: 0 | BI15: 0 | BJ15: 0 | BK15: 0 | BL15: 0 | BM15: 0 | BN15: 0 | BO15: 0 | BP15: 0 | BQ15: 0 | BR15: 26 | BS15: 34 | BT15: 29 | BU15: 2 | BV15: 0 | BW15: 0 | BX15: 0 | BY15: 0 | BZ15: 0 | CA15: 0 | CB15: 0 | CC15: 0 | CD15: 0 | CE15: 0 | CF15: 0 | CG15: 0 | CH15: 0 | CI15: 0 | CJ15: 0 | CK15: 0 | CL15: 0 | CM15: 0 | CN15: 0 | CO15: 0 | CP15: 0 | CQ15: 0 | CR15: 0 | CS15: 0 | CT15: 0 | CU15: 0 | CV15: 0 | CW15: 0 | CX15: 8분간 <[applyrange]>m 내의 파티나 유니온 전원의 물리방어력을 <[abilityvalue1]>만큼, 물리공격 회피율을 <[abilityvalue2]>퍼센트 증가시키는 기술
A16: 774 | B16: 1 | C16: 에테인 블레스 | D16: 185 | E16: 0 | F16: 0 | G16: 0 | H16: 0 | I16: 49 | J16: 6 | K16: 0 | L16: 0 | M16: 0 | N16: 0 | O16: 0 | P16: 1 | Q16: 2 | R16: 5 | S16: 2 | T16: 0 | U16: 4 | V16: 82 | W16: 1 | X16: 1 | Y16: 1 | Z16: 1 | AA16: 1 | AB16: 1 | AC16: 1 | AD16: 1 | AE16: 1 | AF16: 1 | AG16: 1 | AH16: 1 | AI16: 1 | AJ16: 1 | AK16: 1 | AL16: 0 | AM16: 1 | AN16: 1 | AO16: 10 | AP16: 600 | AQ16: 30 | AR16: 0 | AS16: 0 | AT16: 0 | AU16: 0 | AV16: 1 | AW16: 100 | AX16: 8 | AY16: 8 | AZ16: 0 | BA16: 120 | BB16: 0 | BC16: 0 | BD16: 0 | BE16: 0 | BF16: 0 | BG16: 0 | BH16: 0 | BI16: 0 | BJ16: 0 | BK16: 0 | BL16: 0 | BM16: 0 | BN16: 0 | BO16: 0 | BP16: 0 | BQ16: 0 | BR16: 16 | BS16: 1 | BT16: 0 | BU16: 0 | BV16: 0 | BW16: 0 | BX16: 0 | BY16: 0 | BZ16: 0 | CA16: 0 | CB16: 0 | CC16: 0 | CD16: 0 | CE16: 0 | CF16: 0 | CG16: 0 | CH16: 0 | CI16: 0 | CJ16: 0 | CK16: 0 | CL16: 0 | CM16: 0 | CN16: 0 | CO16: 0 | CP16: 0 | CQ16: 0 | CR16: 0 | CS16: 0 | CT16: 0 | CU16: 0 | CV16: 0 | CW16: 0 | CX16: 자신의 남은 활력,마력을 모두 소모해 2분간 자신 중심 반경 <[applyrange]>m 의 모든 파티나 유니온들의 공격속도를 증가시킨다.
A17: 789 | B17: 1 | C17: 컴플리트 리스토어 | D17: 1070 | E17: 0 | F17: 0 | G17: 0 | H17: 0 | I17: 30 | J17: 6 | K17: 0 | L17: 0 | M17: 0 | N17: 0 | O17: 0 | P17: 1 | Q17: 2 | R17: 3 | S17: 3 | T17: 3 | U17: 4 | V17: 81 | W17: 0 | X17: 0 | Y17: 0 | Z17: 0 | AA17: 0 | AB17: 0 | AC17: 0 | AD17: 0 | AE17: 0 | AF17: 1 | AG17: 0 | AH17: 1 | AI17: 0 | AJ17: 0 | AK17: 0 | AL17: 0 | AM17: =INT(49.5) -> 49 | AN17: =INT(256.5) -> 256 | AO17: 6 | AP17: 11 | AQ17: 27 | AR17: 0 | AS17: 0 | AT17: 0 | AU17: 0 | AV17: 1 | AW17: 100 | AX17: 3 | AY17: 0 | AZ17: 0 | BA17: 10 | BB17: 0 | BC17: 0 | BD17: 0 | BE17: 0 | BF17: 0 | BG17: 0 | BH17: 0 | BI17: 0 | BJ17: 0 | BK17: 0 | BL17: 0 | BM17: 0 | BN17: 0 | BO17: 0 | BP17: 0 | BQ17: 0 | BR17: 0 | BS17: 0 | BT17: 0 | BU17: 0 | BV17: 0 | BW17: 0 | BX17: 0 | BY17: 0 | BZ17: 0 | CA17: 0 | CB17: 0 | CC17: 0 | CD17: 0 | CE17: 0 | CF17: 0 | CG17: 0 | CH17: 0 | CI17: 0 | CJ17: 0 | CK17: 0 | CL17: 0 | CM17: 0 | CN17: 0 | CO17: 255 | CP17: 144 | CQ17: 144 | CR17: 0 | CS17: 0 | CT17: 0 | CU17: 0 | CV17: 0 | CW17: 0 | CX17: <[keeptime]>초 동안 매 주기 마다 선택 대상의 체력을 <[timeheal1]>만큼, 활력/마력을 각각 <[timeheal2]>만큼 지속적으로 회복시키는 마법.
A18: 790 | B18: 1 | C18: 파티 리스토어 | D18: 124 | E18: 0 | F18: 0 | G18: 0 | H18: 0 | I18: 32 | J18: 6 | K18: 0 | L18: 0 | M18: 0 | N18: 0 | O18: 0 | P18: 1 | Q18: 0 | R18: 4 | S18: 4 | T18: 3 | U18: 4 | V18: 81 | W18: 1 | X18: 1 | Y18: 1 | Z18: 1 | AA18: 1 | AB18: 1 | AC18: 1 | AD18: 1 | AE18: 1 | AF18: 1 | AG18: 1 | AH18: 1 | AI18: 1 | AJ18: 1 | AK18: 1 | AL18: 0 | AM18: 0 | AN18: =INT(408.6) -> 408 | AO18: 6 | AP18: 9 | AQ18: 0 | AR18: 0 | AS18: 0 | AT18: 0 | AU18: 0 | AV18: 1 | AW18: 100 | AX18: 4 | AY18: 11 | AZ18: 0 | BA18: 12 | BB18: 0 | BC18: 0 | BD18: 0 | BE18: 0 | BF18: 0 | BG18: 0 | BH18: 0 | BI18: 0 | BJ18: 0 | BK18: 0 | BL18: 0 | BM18: 0 | BN18: 0 | BO18: 0 | BP18: 0 | BQ18: 0 | BR18: 0 | BS18: 0 | BT18: 0 | BU18: 0 | BV18: 0 | BW18: 0 | BX18: 0 | BY18: 0 | BZ18: 0 | CA18: 0 | CB18: 0 | CC18: 0 | CD18: 0 | CE18: 0 | CF18: 0 | CG18: 0 | CH18: 0 | CI18: 0 | CJ18: 0 | CK18: 0 | CL18: 0 | CM18: 0 | CN18: 0 | CO18: 460 | CP18: 0 | CQ18: 0 | CR18: 0 | CS18: 0 | CT18: 0 | CU18: 0 | CV18: 0 | CW18: 0 | CX18: 자신 반경 <[applyrange]>m 이내의 파티원 전원의 체력을 <[keeptime]>초 동안 매 주기 마다 <[timeheal1]>씩 지속적으로 회복시키는 마법